Season,Week,Match Date,Home Team,Away Team,Home Goals,Away Goals,Home Performance,Away Performance,Home Formation,Away Formation,Home Players,Away Players
19/20,Round 18,18/01/20,Gaziantep,Fenerbahçe,0,2,6.53,7.18,5-3-2,4-1-4-1,(c) G. Güvenç; O. Ceylan; P. Djilobodji; J. A. Kana-Biyik; A. Toșca; J. Morais; R. Chibsah; J. Junior; S. Diarra; K. Özer; O. Kayode,A. Bayındır; Mauricio Isla; Jailson; S. Aziz; N. Dirar; L. Gustavo; T. Ciğerci; O. Tufan; (c) E. Belözoğlu; M. Kruse; V. Muriqi
19/20,Round 18,19/01/20,Antalyaspor,Göztepe,0,3,6.37,7.35,4-2-3-1,4-2-3-1,R. Boffin; O. Čelůstka; Chico; (c) D. Angelo; F. Kudryashov; H. Özmert; Charles; A. d. Silva; A. Chahechouhe; D. Sinik; G. Blanco,(c) Beto; M. Paluli; C. Borges; L. Schwechlen; B. Emir; A. Castro; S. Aydoğdu; H. Akbunar; S. Napoleoni; S. Gürler; C. Jerome
19/20,Round 18,19/01/20,Galatasaray,Denizlispor,2,1,7.24,6.49,4-2-3-1,4-2-3-1,(c) F. Muslera; M. Linnes; R. Donk; Marcão; M. Saracchi; M. Lemina; J. M. Seri; S. Feghouli; E. Akbaba; Ö. Bayram; R. Falcao,A. Stachowiak; Z. Yavru; O. Yılmaz; M. Yumlu; T. Lopes; O. Onazi; R. Murawski; H. Sacko; I. Aissati; O. Şahan; (c) H. Rodallega
19/20,Round 18,19/01/20,Trabzonspor,Kasımpaşa,6,0,7.41,5.95,4-1-4-1,4-2-3-1,U. Çakır; J. Pereira; H. Türkmen; G. Campi; K. A. Çörekçi; J. O. Mikel; C. Ekuban; (c) J. Sosa; B. Ndiaye; A. N. Nwakaeme; A. Sørloth,F. Öztürk; D. Haspolat; J. Fernandes; T. Břečka; Ö. Çek; T. Serbest; A. Kara; I. Depe; H. Hajradinović; M. Thiam; (c) B. Koita
19/20,Round 18,19/01/20,Beşiktaş,Sivasspor,1,2,6.75,6.87,4-2-3-1,4-1-4-1,L. Karius; G. Gönül; D. Vida; E. Roco; P. Rebocho; M. Elneny; A. Hutchinson; G. N'Koudou; A. Ljajić; C. Erkin; (c) B. Yılmaz,M. Samassa; M. Goiano; A. Appindangoyé; C. Osmanpaşa; U. Çiftçi; F. Aksoy; E. Yeşilyurt; H. Arslan; (c) Z. Erdal; E. Kılınç; M. Yatabaré
19/20,Round 18,20/01/20,Rizespor,Gençlerbirliği,2,0,7.04,6.78,4-2-3-1,4-2-3-1,G. Akkan; M. Morozyuk; M. Abarhoun; M. Talbi; D. Melnjak; (c) A. Durak; I. Diomandé; F. Boldrin; D. Garmash; B. Samudio; M. Škoda,K. Nordfeldt; A. Oğuz; M. Bjärsmyr; Z. Touré; P. Polomat; F. Baiano; (c) S. Sessègnon; D. Candeias; F. Ayité; S. Yılmaz; G. Sio
19/20,Round 17,27/12/19,Beşiktaş,Gençlerbirliğix2,4,1,7.31,6.01,4-2-3-1,4-2-3-1,L. Karius; G. Gönül; D. Vida; V. Ruiz; C. Erkin; M. Elneny; (c) A. Hutchinson; A. Diaby; A. Ljajić; G. N'Koudou; M. U. Nayir,E. Özbir; E. Özgenç; M. Bjärsmyr; Z. Touré; P. Polomat; Y. Pehlivan; (c) S. Sessègnon; D. Candeias; F. Ayité; S. Yılmaz; N. Çiftçi
19/20,Round 17,28/12/19,Ankaragücü,Denizlispor,2,2,6.94,6.38,4-2-3-1,4-2-3-1,K. Çelikay; C. Karayel; A. Kubalas; M. Pazdan; T. Pinto; (c) S. Ağçay; R. Faty; S. Kitsiou; H. Canteros; İ. Parlak; D. Orgill,A. Stachowiak; Z. Yavru; O. Yılmaz; M. Yumlu; O. Şahan; I. Sackey; R. Murawski; H. Sacko; I. Aissati; M. Barrow; (c) H. Rodallega
19/20,Round 17,28/12/19,Başakşehir,Kasımpaşa,5,1,7.05,6.61,4-4-2,4-2-3-1,M. Günok; J. Caiçara; C. Ponck; A. Epureanu; G. Clichy; (c) E. Višća; M. Topal; İ. C. Kahveci; E. Elia; E. Crivelli; D. Ba,F. Öztürk; K. Hafez; J. Fernandes; S. B. Youssef; O. Veigneau; V. Sarı; A. Kara; M. Thiam; H. Hajradinović; (c) R. Quaresma; B. Koita
19/20,Round 17,28/12/19,Trabzonspor,Kayserispor,6,2,7.32,6.47,4-1-4-1,4-2-3-1,U. Çakır; J. Pereira; H. Türkmen; G. Campi; F. Novák; J. O. Mikel; D. Sturridge; (c) J. Sosa; A. Parmak; A. N. Nwakaeme; A. Sørloth,İ. Çipe; R. E. Civelek; O. C. Cotur; M. Kula; Y. Subaşı; B. D. Djédjé; H. H. Acar; O. Uzun; E. Demir; Z. Alkurt; (c) A. Kravets
19/20,Round 17,28/12/19,Galatasaray,Antalyaspor,5,0,7.35,6.18,4-2-3-1,5-4-1,(c) F. Muslera; Mariano; R. Donk; Marcão; Y. Nagatomo; M. Lemina; J. M. Seri; S. Feghouli; T. Antalyalı; Ö. Bayram; R. Falcao,R. Boffin; N. Sangaré; S. Dursun; Chico; O. Čelůstka; T. Çamdal; A. d. Silva; U. Akyol; (c) H. Özmert; D. Sinik; G. Blanco
19/20,Round 17,29/12/19,Sivasspor,Göztepe,1,0,7.15,6.58,4-3-3,4-2-3-1,M. Samassa; M. Goiano; A. Appindangoyé; C. Osmanpaşa; U. Çiftçi; (c) H. Arslan; F. Aksoy; M. H. Yandaş; E. Kılınç; M. Yatabaré; F. Andrade,(c) Beto; M. Paluli; W. Reis; L. Schwechlen; B. Emir; A. Castro; S. Aydoğdu; S. Napoleoni; M. Mossoró; H. Akbunar; D. Kadah
19/20,Round 17,29/12/19,Alanyaspor,Konyaspor,2,1,7.28,6.64,4-2-3-1,4-4-2,Marafona; Baiano; Welinton; S. Caulker; F. N'Sakala; S. Uçan; C. Gülselam; (c) E. Karaca; A. Bakasetas; D. Braume; P. D. Cissé,S. Kırıntılı; (c) A. Turan; S. Ay; M. Aničić; A. Uludağ; D. Milošević; M. Jevtović; J. Jønsson; A. Hadžiahmetović; F. Miya; E. Daci
19/20,Round 17,29/12/19,Gaziantep,Yeni Malatyaspor,1,1,6.62,6.69,3-5-2,4-2-3-1,(c) G. Güvenç; P. Djilobodji; J. A. Kana-Biyik; A. Toșca; O. Ceylan; S. Diarra; J. Junior; G. Vural; J. Morais; O. Kayode; K. Özer,F. Farnolle; Ö. Özdemir; M. Akbaş; T. L. Hadebe; S. Aytaç; (c) M. Yildirim; R. Yalçın; Guilherme Marques; M. Donald; T. Bifouma; A. Jahović
19/20,Round 17,29/12/19,Rizespor,Fenerbahçe,1,2,6.69,6.91,4-2-3-1,4-2-3-1,G. Akkan; O. Ovacıklı; M. Abarhoun; M. Talbi; D. Melnjak; (c) A. Durak; I. Diomandé; F. Boldrin; A. Vetrih; A. Umar; O. Çağlayan,A. Bayındır; Mauricio Isla; Jailson; Zanka; N. Dirar; (c) O. Tufan; L. Gustavo; D. Türüç; M. Kruse; T. Ciğerci; V. Muriqi
19/20,Round 16,20/12/19,Antalyaspor,Ankaragücü,2,2,6.64,6.73,4-2-3-1,5-4-1,F. Kaplan; N. Sangaré; O. Čelůstka; (c) D. Angelo; E. Albayrak; H. Özmert; Chico; A. d. Silva; A. Chahechouhe; S. Özkan; G. Blanco,K. Çelikay; C. Karayel; A. Kubalas; A. Kulušić; M. Pazdan; T. Pinto; H. Canteros; (c) S. Ağçay; R. Faty; S. Kitsiou; İ. Parlak
19/20,Round 16,21/12/19,Yeni Malatyaspor,Rizespor,0,2,6.8,6.96,4-2-3-1,4-2-3-1,F. Farnolle; Ö. Özdemir; M. Akbaş; T. L. Hadebe; S. Aytaç; R. Yalçın; (c) M. Yildirim; Guilherme Marques; M. Donald; M. Fofana; A. Jahović,G. Akkan; M. Morozyuk; M. Abarhoun; M. Talbi; D. Melnjak; (c) A. Durak; I. Diomandé; F. Boldrin; A. Vetrih; A. Umar; O. Çağlayan
19/20,Round 16,21/12/19,Kasımpaşa,Gaziantep,3,4,6.62,6.75,4-2-3-1,5-3-2,F. Öztürk; S. Popov; V. Sarı; J. Fernandes; Ö. Çek; A. Khalili; A. Kara; (c) R. Quaresma; T. Heintz; M. Pektemek; B. Koita,(c) G. Güvenç; O. Ceylan; P. Djilobodji; J. A. Kana-Biyik; A. Toșca; J. Morais; S. Diarra; J. Junior; G. Vural; K. Özer; O. Kayode
19/20,Round 16,21/12/19,Göztepe,Galatasaray,2,1,7.02,6.6,4-2-3-1,4-4-2,(c) Beto; L. Gassama; W. Reis; Titi; L. Schwechlen; A. Castro; S. Aydoğdu; H. Akbunar; S. Napoleoni; S. Gürler; C. Jerome,F. Muslera; Mariano; R. Donk; Marcão; Y. Nagatomo; S. Feghouli; (c) S. İnan; Y. Belhanda; Ö. Bayram; R. Falcao; R. Babel
19/20,Round 16,22/12/19,Gençlerbirliği,Sivasspor,2,2,6.88,6.95,4-2-3-1,4-1-4-1,E. Özbir; F. Baiano; M. Bjärsmyr; Z. Touré; H. I. Pehlivan; Y. Pehlivan; (c) S. Sessègnon; D. Candeias; M. Seuntjens; S. Yılmaz; B. Stancu,M. Samassa; M. Goiano; A. Appindangoyé; C. Osmanpaşa; U. Çiftçi; (c) Z. Erdal; E. Yeşilyurt; M. H. Yandaş; H. Arslan; M. Yatabaré; A. Koné
19/20,Round 16,22/12/19,Kayserispor,Başakşehir,1,4,6.54,7.19,5-4-1,4-4-2,S. Lung Jr.; Y. Subaşı; M. Lopes; B. Rienstra; M. Kula; A. Abdennour; E. Demir; B. D. Djédjé; H. H. Acar; Z. Alkurt; (c) A. Kravets,M. Günok; J. Caiçara; C. Ponck; A. Epureanu; G. Clichy; E. Višća; (c) M. Tekdemir; İ. C. Kahveci; E. Elia; D. Ba; E. Crivelli
19/20,Round 16,22/12/19,Fenerbahçe,Beşiktaş,3,1,7.06,6.52,4-2-3-1,4-2-3-1,A. Bayındır; Mauricio Isla; Jailson; S. Aziz; N. Dirar; T. Ciğerci; L. Gustavo; (c) O. Tufan; M. Kruse; D. Türüç; V. Muriqi,L. Karius; G. Gönül; D. Vida; E. Roco; P. Rebocho; M. Elneny; A. Hutchinson; J. Lens; A. Diaby; C. Erkin; (c) B. Yılmaz
19/20,Round 16,23/12/19,Denizlispor,Alanyaspor,1,5,6.45,7.23,4-2-3-1,4-2-3-1,A. Stachowiak; Z. Yavru; O. Yılmaz; (c) C. Săpunaru; T. Lopes; I. Sackey; R. Murawski; H. Sacko; Ó. Estupiñán; M. Barrow; H. Rodallega,Marafona; Baiano; Welinton; S. Caulker; F. N'Sakala; S. Uçan; C. Gülselam; (c) E. Karaca; A. Bakasetas; D. Braume; J. Fernandes
19/20,Round 16,23/12/19,Konyaspor,Trabzonspor,0,1,6.73,6.99,4-4-2,4-2-3-1,S. Kırıntılı; N. Skubic; (c) A. Turan; S. Ay; A. Uludağ; A. Hadžiahmetović; V. Fındıklı; J. Jønsson; D. Milošević; R. Bajić; Ö. A. Şahiner,U. Çakır; J. Pereira; H. Türkmen; G. Campi; F. Novák; (c) J. Sosa; J. O. Mikel; D. Sturridge; A. Parmak; A. N. Nwakaeme; A. Sørloth
19/20,Round 15,13/12/19,Alanyaspor,Antalyaspor,0,0,6.82,6.79,4-2-3-1,4-1-4-1,Marafona; Baiano; S. Caulker; G. Tzavellas; F. N'Sakala; M. Siopis; S. Uçan; (c) E. Karaca; A. Bakasetas; J. Fernandes; Y. Bammou,F. Kaplan; N. Sangaré; O. Čelůstka; (c) D. Angelo; E. Albayrak; Charles; A. d. Silva; U. Akyol; H. Özmert; D. Sinik; A. Chahechouhe
19/20,Round 15,14/12/19,Rizespor,Kasımpaşa,0,3,6.42,7.11,4-2-3-1,4-2-3-1,G. Akkan; (c) A. Durak; M. Abarhoun; M. Talbi; D. Melnjak; I. Diomandé; A. Vetrih; B. Samudio; F. Boldrin; A. Umar; O. Çağlayan,F. Öztürk; S. Popov; J. Fernandes; S. B. Youssef; Ö. Çek; L. Sadiku; A. Kara; (c) R. Quaresma; H. Hajradinović; M. Pektemek; B. Koita
19/20,Round 15,14/12/19,Gençlerbirliği,Göztepe,3,1,6.69,6.66,4-2-3-1,4-2-3-1,A. Diallo; F. Baiano; M. Bjärsmyr; Z. Touré; H. I. Pehlivan; Y. Pehlivan; (c) S. Sessègnon; D. Candeias; G. Sio; M. Seuntjens; B. Stancu,(c) Beto; L. Gassama; W. Reis; Titi; B. Emir; A. Castro; C. Borges; H. Akbunar; S. Napoleoni; S. Gürler; C. Jerome
19/20,Round 15,14/12/19,Galatasaray,Ankaragücü,2,2,6.69,6.66,4-1-4-1,5-4-1,F. Muslera; Mariano; (c) R. Donk; Marcão; Y. Nagatomo; M. Lemina; S. Feghouli; Ö. Bayram; Y. Belhanda; R. Babel; R. Falcao,K. Çelikay; C. Karayel; A. Kubalas; A. Kulušić; M. Pazdan; T. Pinto; S. Kitsiou; (c) S. Ağçay; R. Faty; İ. Parlak; D. Orgill
19/20,Round 15,15/12/19,Gaziantep,Kayserispor,3,0,7.24,,5-3-2,4-2-3-1,(c) G. Güvenç; O. Ceylan; P. Djilobodji; J. A. Kana-Biyik; A. Toșca; J. Morais; P. Twumasi; R. Chibsah; G. Vural; M. Demir; O. Kayode,S. Lung Jr.; M. Lopes; B. Poulain; M. Kula; Y. Subaşı; B. D. Djédjé; H. H. Acar; E. Demir; B. Mensah; Z. Alkurt; (c) A. Kravets
19/20,Round 15,15/12/19,Sivasspor,Fenerbahçex2,3,1,7.05,6.64,4-3-3,4-2-3-1,M. Samassa; M. Goiano; A. Appindangoyé; C. Osmanpaşa; U. Çiftçi; (c) Z. Erdal; F. Aksoy; M. H. Yandaş; E. Kılınç; M. Yatabaré; F. Andrade,A. Bayındır; Mauricio Isla; S. Çiftpınar; S. Aziz; N. Dirar; L. Gustavo; (c) E. Belözoğlu; O. Tufan; M. Kruse; G. Rodrigues; V. Muriqi
19/20,Round 15,15/12/19,Beşiktaş,Yeni Malatyaspor,0,2,6.49,6.94,4-2-3-1,4-2-3-1,L. Karius; G. Gönül; D. Vida; E. Roco; P. Rebocho; A. Hutchinson; M. Elneny; A. Diaby; A. Ljajić; C. Erkin; (c) B. Yılmaz,F. Farnolle; I. Chebake; A. Mina; T. L. Hadebe; S. Aytaç; (c) M. Yildirim; R. Yalçın; Guilherme Marques; M. Donald; M. Fofana; A. Jahović
19/20,Round 15,16/12/19,Başakşehir,Konyaspor,1,1,6.94,6.94,4-1-4-1,4-4-2,M. Günok; J. Caiçara; C. Ponck; A. Epureanu; G. Clichy; M. Topal; (c) E. Višća; D. Aleksić; İ. C. Kahveci; E. Elia; E. Crivelli,S. Kırıntılı; N. Skubic; (c) S. Ay; M. Aničić; F. Öztorun; A. Hadžiahmetović; V. Fındıklı; J. Jønsson; D. Milošević; R. Bajić; Ö. A. Şahiner
19/20,Round 15,16/12/19,Trabzonspor,Denizlispor,1,2,6.81,6.93,4-4-1-1,4-2-3-1,U. Çakır; J. Pereira; H. Türkmen; G. Campi; F. Novák; Y. Sarı; J. O. Mikel; (c) J. Sosa; A. N. Nwakaeme; D. Sturridge; A. Sørloth,A. Stachowiak; Z. Yavru; O. Yılmaz; M. Yumlu; Z. Bergdich; I. Aissati; R. Murawski; H. Sacko; O. Şahan; M. Barrow; (c) H. Rodallega
19/20,Round 14,06/12/19,Fenerbahçe,Gençlerbirliği,5,2,7.14,6.56,4-2-3-1,4-2-3-1,A. Bayındır; Mauricio Isla; S. Çiftpınar; S. Aziz; H. A. Kaldırım; (c) E. Belözoğlu; L. Gustavo; O. Tufan; M. Kruse; G. Rodrigues; V. Muriqi,E. Özbir; D. Candeias; F. Ramos; Z. Touré; H. I. Pehlivan; F. Baiano; B. A. Özdemir; (c) S. Sessègnon; G. Sio; P. Polomat; B. Stancu
19/20,Round 14,07/12/19,Yeni Malatyaspor,Sivasspor,1,3,6.64,7.0,4-2-3-1,4-1-4-1,F. Farnolle; (c) I. Chebake; R. Yalçın; M. Akbaş; S. Aytaç; A. Afriyie; M. Donald; G. Töre; Guilherme Marques; T. Bifouma; A. Jahović,M. Samassa; M. Goiano; A. Appindangoyé; C. Osmanpaşa; U. Çiftçi; F. Aksoy; E. Kılınç; (c) H. Arslan; M. H. Yandaş; F. Andrade; A. Koné
19/20,Round 14,07/12/19,Ankaragücü,Göztepe,1,3,6.57,6.96,4-2-3-1,4-2-3-1,K. Çelikay; S. Kitsiou; A. Kulušić; M. Pazdan; T. Pinto; W. Moke; (c) S. Ağçay; A. Karabulut; H. Canteros; İ. Parlak; D. Orgill,(c) Beto; L. Gassama; A. Öztürk; Titi; B. Emir; S. Aydoğdu; A. Castro; H. Akbunar; S. Napoleoni; S. Gürler; C. Jerome
19/20,Round 14,07/12/19,Galatasaray,Alanyaspor,1,0,6.98,6.88,4-1-4-1,4-2-3-1,(c) F. Muslera; Mariano; R. Donk; Marcão; Y. Nagatomo; S. N'Zonzi; Y. Belhanda; M. Lemina; J. M. Seri; Ö. Bayram; A. Büyük,Marafona; Baiano; Welinton; S. Caulker; F. N'Sakala; M. Siopis; C. Gülselam; (c) E. Karaca; A. Bakasetas; J. Fernandes; Y. Bammou
19/20,Round 14,08/12/19,Konyaspor,Gaziantep,0,0,7.03,6.97,4-4-2,5-3-2,S. Kırıntılı; N. Skubic; (c) S. Ay; M. Aničić; F. Öztorun; Ö. A. Şahiner; V. Fındıklı; J. Jønsson; D. Milošević; F. Miya; R. Bajić,(c) G. Güvenç; O. Ceylan; P. Djilobodji; J. A. Kana-Biyik; A. Toșca; G. Vural; F. Soyalp; R. Chibsah; J. Junior; P. Twumasi; O. Kayode
19/20,Round 14,08/12/19,Antalyaspor,Trabzonspor,1,3,6.79,7.02,4-3-1-2,4-2-3-1,F. Kaplan; N. Sangaré; O. Čelůstka; (c) D. Angelo; E. Albayrak; U. Akyol; H. Özmert; D. Sinik; Fredy; P. Mukairu; G. Blanco,(c) U. Çakır; S. Asan; H. Türkmen; G. Campi; K. A. Çörekçi; A. Parmak; J. O. Mikel; Y. Sarı; D. Sturridge; A. N. Nwakaeme; A. Sørloth
19/20,Round 14,08/12/19,Denizlispor,Başakşehir,1,1,6.81,6.91,4-2-3-1,4-1-4-1,A. Stachowiak; Z. Yavru; O. Yılmaz; M. Yumlu; T. Lopes; I. Sackey; R. Murawski; H. Sacko; O. Şahan; M. Barrow; (c) H. Rodallega,M. Günok; J. Caiçara; C. Ponck; A. Epureanu; G. Clichy; M. Topal; (c) E. Višća; İ. C. Kahveci; D. Aleksić; E. Elia; D. Ba
19/20,Round 14,08/12/19,Kasımpaşa,Beşiktaş,2,3,6.49,7.07,4-2-3-1,4-2-3-1,F. Öztürk; S. Popov; V. Sarı; S. B. Youssef; K. Hafez; H. Hajradinović; L. Sadiku; (c) R. Quaresma; T. Heintz; M. Pektemek; B. Koita,L. Karius; G. Gönül; D. Vida; E. Roco; P. Rebocho; M. Elneny; A. Hutchinson; A. Diaby; A. Ljajić; C. Erkin; (c) B. Yılmaz
19/20,Round 14,09/12/19,Kayserispor,Rizespor,1,0,7.16,6.84,4-2-3-1,4-2-3-1,S. Lung Jr.; M. Lopes; B. Poulain; M. Kula; Y. Subaşı; B. D. Djédjé; H. H. Acar; Z. Alkurt; B. Mensah; P. Henrique; (c) A. Kravets,G. Akkan; O. Ovacıklı; M. Abarhoun; M. Talbi; D. Melnjak; (c) A. Durak; J. Attamah; B. Samudio; A. Vetrih; A. Umar; O. Çağlayan
19/20,Round 13,29/11/19,Gençlerbirliği,Yeni Malatyaspor,3,3,6.71,6.76,4-2-3-1,4-1-4-1,E. Özbir; E. Özgenç; F. Ramos; Z. Touré; H. I. Pehlivan; F. Baiano; B. A. Özdemir; G. Sio; (c) S. Sessègnon; D. Candeias; B. Stancu,F. Farnolle; (c) I. Chebake; A. Mina; M. Akbaş; S. Aytaç; R. Yalçın; G. Töre; A. Afriyie; A. Ildız; T. Bifouma; A. Jahović
19/20,Round 13,30/11/19,Rizespor,Konyaspor,3,1,7.0,6.59,4-2-3-1,4-4-2,Z. Görgen; O. Ovacıklı; M. Abarhoun; M. Talbi; D. Melnjak; J. Attamah; (c) A. Durak; B. Samudio; A. Vetrih; A. Umar; O. Çağlayan,S. Kırıntılı; N. Skubic; F. Diagne; M. Aničić; F. Öztorun; (c) Ö. A. Şahiner; A. Hadžiahmetović; J. Jønsson; D. Milošević; F. Miya; R. Bajić
19/20,Round 13,30/11/19,Sivasspor,Kasımpaşa,2,0,7.15,6.88,4-3-3,4-2-3-1,M. Samassa; M. Goiano; A. Appindangoyé; C. Osmanpaşa; U. Çiftçi; M. H. Yandaş; F. Aksoy; (c) H. Arslan; E. Kılınç; M. Yatabaré; F. Andrade,F. Öztürk; S. Popov; J. Fernandes; S. B. Youssef; K. Hafez; L. Sadiku; A. Kara; B. Koita; A. Khalili; (c) R. Quaresma; M. Pektemek
19/20,Round 13,30/11/19,Alanyaspor,Ankaragücü,5,0,7.62,6.19,4-2-3-1,4-2-3-1,Marafona; Baiano; Welinton; S. Caulker; F. N'Sakala; M. Siopis; M. Çağıran; (c) E. Karaca; A. Bakasetas; D. Braume; Y. Bammou,(c) K. Çelikay; C. Karayel; A. Kulušić; M. Pazdan; T. Pinto; S. Kitsiou; W. Moke; H. Kaya; H. Canteros; M. Sak; D. Orgill
19/20,Round 13,30/11/19,Göztepe,Fenerbahçe,2,2,6.73,6.7,4-2-3-1,4-2-3-1,(c) Beto; L. Gassama; A. Öztürk; Titi; B. Emir; A. Castro; S. Aydoğdu; H. Akbunar; S. Napoleoni; S. Gürler; C. Jerome,A. Bayındır; O. Tufan; Zanka; S. Aziz; N. Dirar; L. Gustavo; (c) E. Belözoğlu; V. Moses; D. Türüç; G. Rodrigues; M. Kruse
19/20,Round 13,01/12/19,Gaziantep,Denizlispor,1,2,6.66,6.77,5-3-2,4-2-3-1,(c) G. Güvenç; O. Ceylan; P. Djilobodji; J. A. Kana-Biyik; A. Toșca; G. Vural; S. Diarra; J. Junior; F. Soyalp; O. Kayode; P. Twumasi,A. Stachowiak; T. Lopes; (c) C. Săpunaru; M. Yumlu; Z. Bergdich; I. Sackey; I. Aissati; H. Sacko; O. Şahan; M. Barrow; H. Rodallega
19/20,Round 13,01/12/19,Başakşehir,Antalyaspor,2,0,7.3,6.6,4-1-4-1,4-3-1-2,M. Günok; A. Behich; C. Ponck; A. Epureanu; G. Clichy; M. Topal; (c) E. Višća; B. Özcan; İ. C. Kahveci; E. Elia; E. Crivelli,F. Kaplan; N. Sangaré; O. Čelůstka; (c) D. Angelo; T. Çamdal; U. Akyol; Charles; D. Sinik; H. Özmert; A. Chahechouhe; P. Mukairu
19/20,Round 13,01/12/19,Trabzonspor,Galatasaray,1,1,6.82,6.94,4-3-3,4-1-4-1,U. Çakır; J. Pereira; H. Türkmen; G. Campi; K. A. Çörekçi; J. O. Mikel; M. Hosseini; (c) J. Sosa; Y. Sarı; A. Sørloth; A. N. Nwakaeme,(c) F. Muslera; Mariano; R. Donk; Marcão; Y. Nagatomo; S. N'Zonzi; S. Feghouli; M. Lemina; Y. Belhanda; Ö. Bayram; A. Büyük
19/20,Round 13,02/12/19,Beşiktaş,Kayserispor,4,1,7.25,6.66,4-2-3-1,4-3-3,L. Karius; G. Gönül; D. Vida; E. Roco; C. Erkin; M. Elneny; A. Hutchinson; A. Diaby; A. Ljajić; G. N'Koudou; (c) B. Yılmaz,S. Lung Jr.; M. Lopes; B. Poulain; A. Abdennour; Y. Subaşı; B. D. Djédjé; Ş. Çinaz; H. H. Acar; B. Mensah; (c) E. Adebayor; E. Demir
19/20,Round 12,22/11/19,Galatasaray,Başakşehir,0,1,6.94,6.88,3-5-2,4-1-4-1,O. Kocuk; (c) R. Donk; A. Çalık; Marcão; Mariano; S. Feghouli; M. Lemina; Ö. Bayram; E. Taşdemir; A. Büyük; R. Babel,M. Günok; J. Caiçara; C. Ponck; A. Epureanu; G. Clichy; M. Topal; E. Višća; O. Azubuike; (c) M. Tekdemir; İ. C. Kahveci; E. Crivelli
19/20,Round 12,23/11/19,Denizlispor,Rizespor,2,0,7.08,6.49,4-2-3-1,4-2-3-1,A. Stachowiak; Z. Yavru; (c) C. Săpunaru; M. Yumlu; Z. Bergdich; R. Murawski; I. Sackey; O. Şahan; I. Aissati; B. Çalık; H. Rodallega,Z. Görgen; (c) A. Durak; M. Abarhoun; M. Talbi; D. Melnjak; J. Attamah; I. Diomandé; B. Samudio; Y. Sasse; A. Umar; M. Šćepović
19/20,Round 12,23/11/19,Ankaragücü,Trabzonspor,0,3,6.45,7.27,4-2-3-1,4-1-4-1,K. Çelikay; S. Kitsiou; Y. Ayhan; M. Pazdan; T. Pinto; (c) S. Ağçay; R. Faty; A. Karabulut; H. Canteros; İ. Parlak; D. Orgill,E. Kardeşler; J. Pereira; H. Türkmen; G. Campi; K. A. Çörekçi; M. Hosseini; Y. Sarı; J. O. Mikel; (c) J. Sosa; A. N. Nwakaeme; A. Sørloth
19/20,Round 12,23/11/19,Konyaspor,Beşiktaş,0,1,6.69,6.98,4-4-2,4-2-3-1,S. Kırıntılı; N. Skubic; F. Diagne; M. Aničić; F. Öztorun; (c) Ö. A. Şahiner; M. Jevtović; J. Jønsson; D. Milošević; F. Miya; R. Bajić,L. Karius; G. Gönül; D. Vida; V. Ruiz; P. Rebocho; M. Elneny; A. Hutchinson; A. Diaby; A. Ljajić; C. Erkin; (c) B. Yılmaz
19/20,Round 12,24/11/19,Kayserispor,Sivasspor,1,4,6.54,7.12,4-1-4-1,4-2-3-1,S. Lung Jr.; M. Lopes; B. Poulain; A. Abdennour; Y. Subaşı; Ş. Çinaz; (c) U. Bulut; H. H. Acar; B. D. Djédjé; P. Henrique; E. Adebayor,M. Samassa; M. Goiano; A. Appindangoyé; C. Osmanpaşa; U. Çiftçi; F. Aksoy; (c) H. Arslan; E. Kılınç; M. H. Yandaş; F. Andrade; M. Yatabaré
19/20,Round 12,24/11/19,Alanyaspor,Göztepe,0,1,6.76,7.04,4-2-3-1,4-3-3,Marafona; Baiano; S. Caulker; G. Tzavellas; K. Kanak; M. Siopis; C. Gülselam; (c) E. Karaca; A. Bakasetas; D. Braume; P. D. Cissé,(c) Beto; L. Gassama; W. Reis; Titi; B. Emir; A. Castro; M. Mossoró; S. Aydoğdu; H. Akbunar; C. Jerome; S. Gürler
19/20,Round 12,24/11/19,Kasımpaşa,Gençlerbirliği,1,2,6.83,6.87,4-2-3-1,4-2-3-1,F. Öztürk; S. Popov; J. Fernandes; L. Sadiku; O. Veigneau; A. Khalili; A. Kara; (c) R. Quaresma; H. Hajradinović; M. Pektemek; B. Koita,E. Özbir; E. Özgenç; F. Ramos; Z. Touré; H. I. Pehlivan; F. Baiano; B. A. Özdemir; P. Polomat; (c) S. Sessègnon; N. Çiftçi; B. Stancu
19/20,Round 12,24/11/19,Yeni Malatyaspor,Fenerbahçe,0,0,7.1,7.06,4-2-3-1,4-3-3,F. Farnolle; (c) I. Chebake; M. Akbaş; A. Mina; S. Aytaç; R. Yalçın; A. Afriyie; G. Töre; Guilherme Marques; T. Bifouma; A. Jahović,A. Bayındır; N. Dirar; Zanka; S. Aziz; H. A. Kaldırım; O. Tufan; L. Gustavo; (c) E. Belözoğlu; V. Moses; A. Potuk; T. Ciğerci
19/20,Round 12,25/11/19,Antalyaspor,Gaziantep,1,1,6.87,6.8,3-4-1-2,4-2-3-1,F. Kaplan; B. Öztürk; Charles; O. Čelůstka; N. Sangaré; (c) H. Özmert; U. Akyol; T. Çamdal; A. Chahechouhe; A. d. Silva; P. Mukairu,(c) G. Güvenç; O. Ceylan; J. A. Kana-Biyik; P. Djilobodji; A. Toșca; S. Diarra; J. Junior; G. Vural; F. Soyalp; P. Twumasi; O. Kayode
19/20,Round 11,08/11/19,Fenerbahçe,Kasımpaşa,3,2,6.82,6.64,4-1-4-1,4-2-3-1,A. Bayındır; Mauricio Isla; Zanka; S. Aziz; (c) H. A. Kaldırım; L. Gustavo; V. Moses; O. Tufan; T. Ciğerci; G. Rodrigues; V. Muriqi,F. Öztürk; S. Popov; J. Fernandes; (c) S. B. Youssef; K. Hafez; L. Sadiku; A. Kara; H. Hajradinović; A. Khalili; Y. Erdoğan; B. Koita
19/20,Round 11,09/11/19,Gençlerbirliği,Kayserispor,2,1,6.73,6.83,4-5-1,4-2-3-1,E. Özbir; E. Özgenç; F. Ramos; Z. Touré; H. I. Pehlivan; G. Sio; B. A. Özdemir; (c) S. Sessègnon; N. Çiftçi; D. Candeias; B. Stancu,S. Lung Jr.; B. D. Djédjé; M. Lopes; A. Abdennour; Y. Subaşı; H. H. Acar; Ş. Çinaz; (c) U. Bulut; B. Mensah; P. Henrique; E. Adebayor
19/20,Round 11,09/11/19,Rizespor,Antalyaspor,1,0,6.95,6.94,4-2-3-1,4-2-3-1,T. Çetin; M. Morozyuk; M. Abarhoun; M. Talbi; D. Melnjak; I. Diomandé; A. Vetrih; B. Samudio; (c) F. Boldrin; A. Umar; O. Çağlayan,F. Kaplan; N. Sangaré; B. Öztürk; O. Čelůstka; E. Albayrak; Charles; U. Akyol; A. d. Silva; P. Mukairu; (c) S. Özkan; G. Blanco
19/20,Round 11,09/11/19,Sivasspor,Konyaspor,2,0,7.19,6.51,4-2-3-1,4-4-2,M. Samassa; M. Goiano; A. Appindangoyé; C. Osmanpaşa; (c) Z. Erdal; H. Arslan; F. Aksoy; E. Kılınç; M. H. Yandaş; F. Andrade; M. Yatabaré,S. Kırıntılı; N. Skubic; F. Diagne; M. Aničić; F. Öztorun; L. Shengelia; M. Jevtović; J. Jønsson; A. Hadžiahmetović; (c) Ö. A. Şahiner; F. Miya
19/20,Round 11,09/11/19,Gaziantep,Galatasaray,0,2,6.52,7.0,4-4-2,3-5-2,(c) G. Güvenç; P. Olkowski; J. A. Kana-Biyik; A. Toșca; J. Morais; O. Ceylan; R. Chibsah; P. Djilobodji; G. Vural; P. Twumasi; O. Kayode,(c) F. Muslera; C. Luyindama; A. Çalık; Marcão; Mariano; S. Feghouli; M. Lemina; Ö. Bayram; E. Taşdemir; F. Andone; A. Büyük
19/20,Round 11,10/11/19,Göztepe,Yeni Malatyaspor,1,1,6.61,6.54,4-3-3,4-2-3-1,(c) Beto; L. Gassama; A. Öztürk; Titi; B. Emir; S. Aydoğdu; C. Borges; A. Castro; S. Napoleoni; C. Jerome; S. Gürler,F. Farnolle; I. Chebake; M. Akbaş; T. L. Hadebe; E. Kaş; (c) M. Yildirim; A. Afriyie; Guilherme Marques; M. Donald; G. Töre; A. Jahović
19/20,Round 11,10/11/19,Trabzonspor,Alanyaspor,1,0,6.79,6.62,4-1-4-1,4-2-3-1,U. Çakır; (c) J. Pereira; H. Türkmen; G. Campi; F. Novák; M. Hosseini; Y. Sarı; A. Parmak; K. A. Çörekçi; A. N. Nwakaeme; A. Sørloth,Marafona; O. Bulut; Welinton; G. Tzavellas; F. N'Sakala; C. Gülselam; M. Siopis; (c) E. Karaca; A. Bakasetas; J. Fernandes; P. D. Cissé
19/20,Round 11,10/11/19,Başakşehir,Ankaragücü,2,1,7.19,6.78,4-1-4-1,4-1-4-1,M. Günok; J. Caiçara; C. Ponck; A. Epureanu; G. Clichy; M. Topal; (c) E. Višća; O. Azubuike; B. Özcan; F. Gulbrandsen; E. Crivelli,K. Çelikay; S. Kitsiou; A. Kulušić; M. Pazdan; M. Sak; W. Moke; A. Karabulut; R. Faty; (c) S. Ağçay; İ. Parlak; D. Orgill
19/20,Round 11,10/11/19,Beşiktaş,Denizlispor,1,0,7.1,6.84,4-2-3-1,4-1-4-1,L. Karius; G. Gönül; D. Vida; V. Ruiz; P. Rebocho; M. Elneny; A. Hutchinson; C. Erkin; A. Diaby; A. Ljajić; (c) B. Yılmaz,A. Stachowiak; T. Lopes; (c) C. Săpunaru; M. Yumlu; Z. Bergdich; I. Sackey; O. Şahan; R. Murawski; I. Aissati; M. Barrow; H. Rodallega
19/20,Round 10,01/11/19,Galatasaray,Rizespor,2,0,7.09,6.49,4-1-4-1,4-2-3-1,(c) F. Muslera; Ş. Özbayraklı; C. Luyindama; A. Çalık; Y. Nagatomo; J. M. Seri; E. Mor; M. Lemina; Ö. Bayram; R. Babel; F. Andone,(c) G. Akkan; M. Morozyuk; M. Abarhoun; M. Talbi; D. Melnjak; I. Diomandé; J. Attamah; F. Boldrin; A. Vetrih; A. Umar; O. Çağlayan
19/20,Round 10,02/11/19,Konyaspor,Gençlerbirliği,1,1,6.85,6.78,4-4-1-1,4-4-1-1,S. Kırıntılı; N. Skubic; (c) A. Turan; M. Aničić; A. Uludağ; L. Shengelia; M. Jevtović; J. Jønsson; D. Milošević; F. Miya; Ö. A. Şahiner,E. Özbir; E. Özgenç; F. Ramos; Z. Touré; P. Polomat; G. Sio; (c) S. Sessègnon; B. A. Özdemir; F. Ayité; D. Candeias; B. Stancu
19/20,Round 10,02/11/19,Alanyaspor,Başakşehir,0,0,6.98,6.94,4-2-3-1,4-1-4-1,Marafona; O. Bulut; Welinton; G. Tzavellas; F. N'Sakala; C. Gülselam; M. Siopis; (c) E. Karaca; A. Bakasetas; J. Fernandes; P. D. Cissé,M. Günok; J. Caiçara; M. Škrtel; A. Epureanu; G. Clichy; M. Topal; (c) E. Višća; O. Azubuike; İ. C. Kahveci; E. Elia; E. Crivelli
19/20,Round 10,02/11/19,Trabzonspor,Göztepe,0,1,6.86,7.15,4-1-4-1,4-3-3,U. Çakır; J. Pereira; H. Türkmen; I. Fernandes; F. Novák; D. Erdoğan; Y. Sarı; (c) J. Sosa; A. Canbaz; A. N. Nwakaeme; A. Sørloth,(c) Beto; L. Gassama; A. Öztürk; Titi; B. Emir; A. Castro; C. Borges; S. Aydoğdu; M. Mossoró; C. Jerome; H. Akbunar
19/20,Round 10,02/11/19,Antalyaspor,Beşiktaş,1,2,6.74,6.93,4-1-4-1,4-2-3-1,F. Kaplan; N. Sangaré; B. Öztürk; (c) D. Angelo; E. Albayrak; Chico; P. Mukairu; Charles; U. Akyol; A. Chahechouhe; G. Blanco,L. Karius; G. Gönül; D. Vida; V. Ruiz; P. Rebocho; M. Elneny; (c) A. Hutchinson; J. Lens; A. Diaby; A. Ljajić; M. U. Nayir
