Season,Week,Match Date,Home Team,Away Team,Home Goals,Away Goals,Home Performance,Away Performance,Home Formation,Away Formation,Home Players,Away Players
22/23,Round 11,24/10/22,Giresunspor,Ankaragücü,1,1,6.85,6.77,4-2-3-1,4-2-3-1,(c) O. Piri; H. Bilazer; R. Arias; A. Pérez; A. Uludağ; J. Campuzano; M. C. Akpinar; Serginho; G. Sağlam; B. Sainz; R. Bajić,G. Akkan; K. Malcuit; U. Radaković; N. Mujakić; Y. Güreler; T. Antalyalı; (c) T. Ciğerci; G. Beridze; E. Kılınç; Jesé; A. Sowe
22/23,Round 11,24/10/22,Hatayspor,Beşiktaş,2,1,6.99,6.79,4-3-3,4-2-3-1,E. Kardeşler; (c) K. A. Çörekçi; O. Vranješ; B. Öksüz; S. Adekugbe; M. Boudjemaa; O. Ergün; R. Aabid; A. E. Kaabi; Z. Luís; S. Lobjanidze,E. Destanoğlu; V. Rosier; T. T. Sanuç; F. Montero; A. Masuaku; S. Uçan; (c) Souza; J. Muleka; D. Alli; G. N'Koudou; W. Weghorst
22/23,Round 10,14/10/22,Alanyaspor,Antalyaspor,3,2,6.8,6.71,4-3-3,4-2-3-1,R. Rúnarsson; F. Aksoy; F. Bayır; J. K. Rassoul; Y. Özdemir; A. Lusamba; L. Fer; E. Bekiroğlu; (c) E. Karaca; A. Hassan; D. Candeias,M. A. Uysal; B. Balcı; C. Luyindama; Ö. Toprak; C. Sertel; (c) Fredy; U. Akyol; G. Bayrakdar; L. Adriano; H. Ghacha; H. Wright
22/23,Round 10,15/10/22,Karagümrük,Hatayspor,3,0,7.2,6.53,4-3-3,4-3-3,(c) E. Viviano; D. Biraschi; S. Caulker; I. Drešević; C. Erkin; A. Lawrence; M. Ozdoev; J. Durmaz; J. Kouassi; F. Borini; K. Frei,E. Kardeşler; (c) K. A. Çörekçi; O. Vranješ; B. Öksüz; K. Kanak; M. Boudjemaa; O. Ergün; R. Aabid; A. E. Kaabi; B. Yıldırım; S. Lobjanidze
22/23,Round 10,15/10/22,Kasımpaşa,Adana DS,1,4,6.64,7.27,4-1-4-1,4-2-3-1,E. Taşkıran; F. Hadergjonaj; J. Bruma; S. Çiftpınar; M. B. Ouanes; M. Tirpan; M. Fall; (c) H. Hajradinović; A. Kara; B. Celina; S. Bahoken,E. Özbir; J. Svensson; S. Akaydın; Y. Rakitskyi; K. Rodrigues; (c) B. Stambouli; B. Ndiaye; D. Babajide; E. Akbaba; H. Onyekuru; Y. Belhanda
22/23,Round 10,15/10/22,Kayserispor,Galatasaray,2,1,6.99,6.75,4-1-4-1,4-2-3-1,B. Bayazit; O. Bulut; M. Hosseini; D. Kolovetsios; L. Carole; Campanharo; R. Civelek; O. Kemen; (c) B. Mensah; M. Cardoso; M. Gavranović,(c) F. Muslera; S. Boey; V. Nelsson; A. Bardakcı; K. Karataş; L. Torreira; F. Midtsjø; Y. Akgün; J. Mata; D. Mertens; M. Icardi
22/23,Round 10,15/10/22,Konyaspor,Gaziantep,0,1,6.76,7.02,4-1-4-1,3-4-2-1,(c) I. Šehić; A. Oğuz; A. Demirbağ; K. Demirtaş; G. H. Sityá; A. Hadžiahmetović; K. Michalak; E. Çekiçi; S. Dikmen; Z. Bytyqi; M. Demir,(c) G. Güvenç; A. Kızıldağ; M. Jevtović; A. Toșca; S. Kitsiou; F. Soyalp; A. Parmak; Á. Sagal; J. Figueiredo; A. Maxim; T. Pekhart
22/23,Round 10,16/10/22,Başakşehir,İstanbulspor,2,0,7.09,6.59,4-1-4-1,5-4-1,V. Babacan; Ö. A. Şahiner; L. Duarte; Y. Ndayishimiye; L. Lima; L. Biglia; D. Türüç; (c) M. Tekdemir; B. Özcan; S. Gürler; B. Traoré,D. Jensen; O. Berber; O. Erdoğan; M. Yeşil; A. Mehremić; A. Yaşar; J. Topalli; (c) E. Rroca; M. Sarıkaya; V. Ethemi; İ. Yilmaz
22/23,Round 10,16/10/22,Beşiktaş,Trabzonspor,2,2,6.8,6.75,4-2-3-1,4-3-3,E. Destanoğlu; V. Rosier; T. T. Sanuç; F. Montero; A. Masuaku; S. Uçan; (c) Souza; R. Ghezzal; D. Alli; G. N'Koudou; W. Weghorst,(c) U. Çakır; J. Stryger Larsen; M. Bartra; V. Hugo; E. Elmalı; A. Bakasetas; J. Gbamin; M. Hamšík; A. Ömür; M. Gómez; M. Trézéguet
22/23,Round 10,17/10/22,Ankaragücü,Fenerbahçe,0,3,6.46,7.1,4-2-3-1,3-1-4-2,G. Akkan; K. Malcuit; U. Radaković; N. Mujakić; Y. Güreler; T. Antalyalı; (c) T. Ciğerci; G. Beridze; E. Kılınç; Jesé; A. Sowe,(c) A. Bayındır; S. Aziz; Gustavo Henrique; A. Szalai; M. Crespo; B. Osayi-Samuel; İ. C. Kahveci; Lincoln; F. Kadıoğlu; M. Batshuayi; Enner Valencia
22/23,Round 10,17/10/22,Sivasspor,Giresunspor,3,0,7.09,6.57,4-2-3-1,4-2-3-1,A. Ş. Vural; M. Paluli; D. Goutas; C. Osmanpaşa; U. Çiftçi; (c) H. Arslan; R. Yalçın; C. N'Jie; D. Saba; E. Yeşilyurt; M. Yatabaré,(c) O. Piri; H. Bilazer; R. Arias; A. Pérez; A. Uludağ; J. Campuzano; G. Sağlam; B. Kuwas; V. Savićević; B. Sainz; R. Bajić
22/23,Round 9,07/10/22,Gaziantep,Adana DS,1,1,6.89,6.97,3-4-2-1,4-2-3-1,(c) G. Güvenç; P. Djilobodji; E. Ersoy; A. Toșca; S. Kitsiou; F. Soyalp; M. Jevtović; Á. Sagal; J. Figueiredo; A. Maxim; T. Pekhart,E. Özbir; J. Svensson; (c) S. Akaydın; S. Güler; K. Rodrigues; B. Ndiaye; E. Akbaba; D. Babajide; Y. Belhanda; H. Onyekuru; B. Assombalonga
22/23,Round 9,08/10/22,İstanbulspor,Ankaragücü,1,2,6.81,6.8,3-4-2-1,4-1-4-1,D. Jensen; O. Erdoğan; M. Yeşil; A. Mehremić; O. Berber; (c) E. Rroca; M. Sarıkaya; T. D. Aksu; J. Topalli; V. Ethemi; İ. Yilmaz,G. Akkan; O. Ceylan; U. Radaković; N. Mujakić; Y. Güreler; (c) T. Ciğerci; E. Kılınç; T. Antalyalı; Pedrinho; G. Beridze; A. Sowe
22/23,Round 9,08/10/22,Antalyaspor,Konyaspor,1,1,6.72,6.78,4-2-3-1,4-1-4-1,M. A. Uysal; B. Balcı; C. Luyindama; Ö. Toprak; (c) G. Vural; Fernando; U. Akyol; S. Gümüş; L. Adriano; A. Ndao; H. Wright,(c) I. Šehić; A. Oğuz; A. Demirbağ; F. Calvo; G. H. Sityá; A. Hadžiahmetović; R. Murić; B. Paz; S. Dikmen; Z. Bytyqi; M. Demir
22/23,Round 9,08/10/22,Giresunspor,Beşiktaş,0,1,6.77,6.87,4-2-3-1,4-2-3-1,(c) O. Piri; H. Bilazer; R. Arias; A. Pérez; A. Uludağ; J. Campuzano; M. C. Akpinar; B. Kuwas; G. Sağlam; B. Sainz; R. Bajić,E. Destanoğlu; V. Rosier; T. T. Sanuç; R. Saiss; A. Masuaku; G. Fernandes; (c) Souza; T. Bingöl; D. Alli; N. Redmond; W. Weghorst
22/23,Round 9,09/10/22,Ümraniyespor,Kayserispor,2,2,6.71,6.73,4-1-4-1,4-1-4-1,O. Özdemir; S. Göksu; Allyson; (c) T. Glumac; E. Lenjani; I. Sackey; Geraldo; K. K. Yılmaz; D. Avounou; O. Ayık; M. U. Nayir,B. Bayazit; O. Bulut; M. Hosseini; D. Kolovetsios; L. Carole; Campanharo; R. Civelek; O. Kemen; (c) B. Mensah; M. Cardoso; M. Gavranović
22/23,Round 9,09/10/22,Hatayspor,Alanyaspor,1,0,6.96,6.78,4-3-3,4-3-3,E. Kardeşler; K. Alıcı; O. Vranješ; B. Öksüz; K. Kanak; M. Boudjemaa; O. Ergün; R. Aabid; (c) A. E. Kaabi; B. Yıldırım; S. Lobjanidze,R. Rúnarsson; P. Pereira; F. Bayır; F. Aksoy; J. Balkovec; I. Doumbia; U. Güneş; E. Bekiroğlu; (c) E. Karaca; A. Hassan; D. Candeias
22/23,Round 9,09/10/22,Fenerbahçe,Karagümrük,5,4,6.63,6.61,4-1-3-2,4-3-3,(c) A. Bayındır; B. Osayi-Samuel; Gustavo Henrique; A. Szalai; Lincoln; İ. Yüksek; E. Mor; M. Crespo; İ. C. Kahveci; João Pedro Galvão; Enner Valencia,(c) E. Viviano; S. Dursun; D. Biraschi; I. Drešević; C. Erkin; J. Durmaz; M. Ozdoev; O. Shukurov; E. Colley; F. Borini; J. Kouassi
22/23,Round 9,10/10/22,Başakşehir,Sivasspor,0,2,6.74,7.2,4-3-3,4-2-3-1,M. Şengezer; Ö. A. Şahiner; Y. Ndayishimiye; (c) A. Epureanu; L. Lima; D. Türüç; L. Biglia; B. Özcan; B. Traoré; P. P. Keny; M. Chouiar,A. Ş. Vural; M. Paluli; D. Goutas; C. Osmanpaşa; (c) U. Çiftçi; R. Yalçın; F. Ulvestad; C. N'Jie; D. Saba; E. Yeşilyurt; M. Yatabaré
22/23,Round 9,10/10/22,Trabzonspor,Kasımpaşa,0,0,6.91,6.93,4-3-3,4-1-4-1,(c) U. Çakır; J. Stryger Larsen; M. Bartra; V. Hugo; E. Elmalı; A. Bakasetas; M. Siopis; M. Hamšík; Y. Yazıcı; M. Gómez; M. Trézéguet,E. Taşkıran; F. Hadergjonaj; J. Bruma; S. Çiftpınar; M. B. Ouanes; M. Tirpan; M. Fall; (c) H. Hajradinović; V. Eysseric; B. Celina; S. Bahoken
22/23,Round 8,01/10/22,Kasımpaşa,Gaziantep,1,0,6.95,6.75,4-1-4-1,4-2-3-1,E. Taşkıran; F. Hadergjonaj; J. Bruma; S. Çiftpınar; M. B. Ouanes; M. Tirpan; M. Fall; (c) H. Hajradinović; V. Eysseric; B. Celina; S. Bahoken,(c) G. Güvenç; S. Kitsiou; E. Ersoy; A. Toșca; M. Hanousek; F. Soyalp; M. Jevtović; L. Marković; A. Maxim; Á. Sagal; T. Pekhart
22/23,Round 8,01/10/22,Kayserispor,Trabzonspor,1,2,6.75,6.85,4-5-1,4-2-3-1,B. Bayazit; O. Bulut; M. Hosseini; D. Kolovetsios; L. Carole; R. Civelek; M. Cardoso; Campanharo; (c) B. Mensah; M. Thiam; M. Gavranović,(c) U. Çakır; J. Stryger Larsen; M. Bartra; V. Hugo; E. Elmalı; M. Hamšík; M. Siopis; A. Ömür; A. Bakasetas; M. Trézéguet; M. Gómez
22/23,Round 8,01/10/22,Ankaragücü,Başakşehir,1,2,6.63,6.89,4-1-4-1,4-3-3,G. Akkan; O. Ceylan; U. Radaković; N. Mujakić; Y. Güreler; (c) T. Ciğerci; E. Kılınç; T. Antalyalı; Pedrinho; G. Beridze; A. Sowe,(c) V. Babacan; Ö. A. Şahiner; Y. Ndayishimiye; A. Touba; H. A. Kaldırım; D. Aleksić; L. Biglia; B. Özcan; B. Traoré; S. Okaka; M. Chouiar
22/23,Round 8,01/10/22,Adana DS,Galatasaray,0,0,6.91,6.94,4-2-3-1,4-2-3-1,E. Özbir; J. Svensson; S. Akaydın; S. Güler; K. Rodrigues; (c) B. Stambouli; B. Ndiaye; Y. Sarı; E. Akbaba; H. Onyekuru; Y. Belhanda,(c) F. Muslera; S. Boey; V. Nelsson; A. Bardakcı; L. Dubois; L. Torreira; F. Midtsjø; Y. Akgün; D. Mertens; K. Aktürkoğlu; B. Gomis
22/23,Round 8,02/10/22,Alanyaspor,Giresunspor,1,1,6.84,6.59,3-4-3,4-2-3-1,R. Rúnarsson; F. Aksoy; F. Bayır; J. Balkovec; P. Pereira; U. Güneş; I. Doumbia; J. K. Rassoul; (c) E. Karaca; A. Hassan; O. Targhalline,(c) O. Piri; H. Bilazer; R. Arias; A. Pérez; A. Uludağ; J. Campuzano; M. C. Akpinar; Serginho; G. Sağlam; B. Sainz; R. Bajić
22/23,Round 8,02/10/22,Sivasspor,Hatayspor,1,2,6.89,6.86,4-2-3-1,4-3-3,A. Ş. Vural; R. Yalçın; D. Goutas; A. Appindangoyé; (c) U. Çiftçi; F. Ulvestad; K. Keïta; E. Yeşilyurt; D. Saba; M. Gradel; M. Yatabaré,E. Kardeşler; K. Alıcı; O. Vranješ; B. Öksüz; K. Kanak; M. Boudjemaa; R. Ribeiro; O. Ergün; (c) A. E. Kaabi; B. Yıldırım; S. Lobjanidze
22/23,Round 8,02/10/22,Konyaspor,Ümraniyespor,1,0,7.01,6.74,4-1-4-1,4-3-3,E. Erentürk; A. Oğuz; A. Demirbağ; F. Calvo; G. H. Sityá; B. Paz; K. Michalak; S. Dikmen; (c) A. Hadžiahmetović; Z. Bytyqi; M. Demir,O. Özdemir; S. Popov; Allyson; (c) T. Glumac; E. Lenjani; S. Göksu; K. K. Yılmaz; A. Mršić; O. Ayık; A. Bettaieb; M. Mimaroğlu
22/23,Round 8,02/10/22,Beşiktaş,Fenerbahçe,0,0,6.93,6.73,4-2-3-1,3-4-1-2,E. Destanoğlu; V. Rosier; T. T. Sanuç; R. Saiss; A. Masuaku; S. Uçan; (c) Souza; J. Muleka; D. Alli; N. Redmond; W. Weghorst,(c) A. Bayındır; S. Aziz; Gustavo Henrique; A. Szalai; F. Kadıoğlu; M. Crespo; Willian Arão; Lincoln; İ. C. Kahveci; João Pedro Galvão; Enner Valencia
22/23,Round 8,03/10/22,Karagümrük,İstanbulspor,1,2,6.75,6.91,4-3-3,3-4-2-1,(c) E. Viviano; S. Dursun; D. Biraschi; S. Caulker; C. Erkin; J. Durmaz; I. Drešević; M. Ozdoev; E. Colley; M. Diagne; J. Kouassi,D. Jensen; O. Erdoğan; A. Mehremić; T. D. Aksu; (c) O. Berber; M. Kabasakal; M. Sarıkaya; A. Yaşar; J. Topalli; E. K. Gültekin; S. Guri
22/23,Round 7,16/09/22,Galatasaray,Konyaspor,2,1,6.91,6.8,4-2-3-1,4-1-4-1,(c) F. Muslera; S. Boey; V. Nelsson; E. Bayram; P. v. Aanholt; L. Torreira; S. Oliveira; Y. Akgün; D. Mertens; K. Aktürkoğlu; B. Gomis,(c) I. Šehić; A. Oğuz; A. Demirbağ; F. Calvo; G. H. Sityá; B. Paz; E. Çekiçi; S. Dikmen; A. Hadžiahmetović; Z. Bytyqi; M. Demir
22/23,Round 7,16/09/22,Hatayspor,Kayserispor,0,4,6.48,7.07,4-3-3,4-5-1,E. Kardeşler; S. Bas; R. B. Yılmaz; B. Öksüz; S. Adekugbe; M. Boudjemaa; R. Ribeiro; O. Ergün; S. Lobjanidze; (c) A. E. Kaabi; D. Saint-Louis,B. Bayazit; O. Bulut; D. Kolovetsios; A. Kocaman; L. Carole; R. Civelek; M. Cardoso; Campanharo; B. Mensah; M. Thiam; (c) İ. Parlak
22/23,Round 7,17/09/22,Ümraniyespor,Kasımpaşa,1,2,6.83,7.09,4-1-4-1,4-1-4-1,O. Özdemir; S. Göksu; I. Sackey; (c) T. Glumac; E. Lenjani; K. K. Yılmaz; Geraldo; O. Gürbulak; D. Avounou; V. Gheorghe; M. U. Nayir,E. Taşkıran; F. Hadergjonaj; J. Bruma; S. Çiftpınar; M. B. Ouanes; M. Tirpan; M. Fall; (c) H. Hajradinović; V. Eysseric; B. Celina; S. Bahoken
22/23,Round 7,17/09/22,Antalyasporx2,Adana DS,0,3,6.11,7.09,4-2-3-1,4-2-3-1,R. Boffin; B. Balcı; (c) V. Sarı; F. Kudryashov; G. Vural; Fredy; S. Aydoğdu; A. Ndao; L. Adriano; H. Ghacha; H. Wright,E. Özbir; J. Svensson; S. Akaydın; Y. Rakitskyi; K. Rodrigues; B. Ndiaye; (c) G. Inler; Y. Sarı; E. Akbaba; H. Onyekuru; Y. Belhanda
22/23,Round 7,17/09/22,İstanbulspor,Beşiktaş,2,2,6.6,6.73,3-4-2-1,4-3-3,D. Jensen; O. Erdoğan; M. Yeşil; T. D. Aksu; O. Berber; M. Kabasakal; M. Sarıkaya; A. Yaşar; J. Topalli; E. K. Gültekin; (c) İ. Yilmaz,E. Destanoğlu; V. Rosier; T. T. Sanuç; R. Saiss; A. Masuaku; S. Uçan; (c) Souza; G. Fernandes; J. Muleka; W. Weghorst; G. N'Koudou
22/23,Round 7,18/09/22,Başakşehir,Karagümrük,0,0,6.97,6.75,4-3-3,4-3-3,V. Babacan; Ö. A. Şahiner; L. Duarte; Y. Ndayishimiye; L. Lima; D. Türüç; L. Biglia; (c) M. Tekdemir; B. Traoré; P. P. Keny; M. Chouiar,(c) E. Viviano; S. Dursun; R. Baniya; I. Drešević; C. Erkin; J. Durmaz; M. Ozdoev; O. Shukurov; J. Kouassi; M. Diagne; F. Borini
22/23,Round 7,18/09/22,Trabzonspor,Gaziantep,3,2,6.98,6.64,4-2-3-1,4-4-1-1,(c) U. Çakır; J. Stryger Larsen; M. Bartra; V. Hugo; E. Elmalı; M. Hamšík; M. Siopis; T. Djaniny; A. Bakasetas; M. Trézéguet; U. Bozok,(c) G. Güvenç; S. Kitsiou; E. Ersoy; P. Djilobodji; M. Hanousek; Á. Sagal; F. Soyalp; M. Jevtović; L. Marković; A. Maxim; J. Figueiredo
22/23,Round 7,18/09/22,Fenerbahçe,Alanyaspor,5,0,7.25,6.4,4-4-2,4-1-4-1,(c) A. Bayındır; F. Kadıoğlu; Gustavo Henrique; A. Szalai; E. Alioski; D. Rossi; Willian Arão; M. Crespo; E. Mor; Enner Valencia; João Pedro Galvão,R. Rúnarsson; P. Pereira; F. Bayır; F. Aksoy; J. Balkovec; L. Fer; D. Candeias; (c) E. Karaca; E. Bekiroğlu; Z. Ferhat; A. Hassan
22/23,Round 7,18/09/22,Ankaragücü,Sivasspor,2,1,6.83,6.72,4-2-3-1,4-2-3-1,G. Akkan; O. Ceylan; U. Radaković; N. Mujakić; Marlon; T. Antalyalı; (c) T. Ciğerci; E. Kılınç; Pedrinho; G. Beridze; A. Sowe,A. Ş. Vural; M. Paluli; D. Goutas; A. Appindangoyé; (c) U. Çiftçi; F. Ulvestad; C. Charisis; A. Musa; D. Saba; M. Gradel; K. Angielski
22/23,Round 6,09/09/22,Alanyaspor,Ankaragücü,2,1,6.98,6.72,4-3-3,4-2-3-1,R. Rúnarsson; P. Pereira; F. Aksoy; F. Bayır; J. Balkovec; U. Güneş; I. Doumbia; E. Bekiroğlu; (c) E. Karaca; W. Eduardo; O. Aydın,B. H. Güngördü; O. Ceylan; A. Çankaya; N. Mujakić; Y. Güreler; T. Antalyalı; (c) T. Ciğerci; G. Ariyibi; Pedrinho; G. Beridze; A. Sowe
22/23,Round 6,10/09/22,Konyaspor,Hatayspor,1,0,7.03,6.67,4-2-3-1,4-3-3,(c) I. Šehić; A. Oğuz; A. Demirbağ; F. Calvo; G. H. Sityá; A. Hadžiahmetović; S. Dikmen; R. Murić; E. Çekiçi; Z. Bytyqi; M. Demir,E. Kardeşler; (c) K. A. Çörekçi; R. B. Yılmaz; S. Falette; S. Adekugbe; M. Boudjemaa; R. Ribeiro; O. Ergün; S. Lobjanidze; A. E. Kaabi; K. Varga
22/23,Round 6,10/09/22,Karagümrük,Giresunspor,1,1,6.94,6.61,4-3-3,4-4-2,(c) E. Viviano; S. Dursun; R. Baniya; I. Drešević; C. Erkin; J. Durmaz; M. Ozdoev; O. Shukurov; E. Colley; M. Diagne; F. Borini,(c) O. Piri; H. Bilazer; A. Pérez; R. Arias; A. Uludağ; Serginho; J. Campuzano; R. Mejía; B. Sainz; V. Savićević; R. Bajić
22/23,Round 6,11/09/22,Sivasspor,İstanbulspor,1,1,6.79,6.78,4-2-3-1,3-4-2-1,A. Ş. Vural; M. Paluli; D. Goutas; C. Osmanpaşa; (c) Z. Erdal; F. Ulvestad; C. Charisis; C. N'Jie; D. Saba; M. Gradel; M. Yatabaré,D. Jensen; O. Erdoğan; M. Yeşil; T. D. Aksu; O. Berber; M. Kabasakal; M. Sarıkaya; A. Yaşar; J. Topalli; V. Ethemi; (c) İ. Yilmaz
22/23,Round 6,11/09/22,Gaziantep,Ümraniyespor,1,1,6.76,7.01,4-4-1-1,4-1-4-1,(c) G. Güvenç; S. Kitsiou; E. Ersoy; P. Djilobodji; M. Hanousek; Á. Sagal; A. Parmak; M. Jevtović; M. Eskihellaç; A. Maxim; J. Figueiredo,O. Özdemir; S. Göksu; I. Sackey; (c) T. Glumac; E. Lenjani; K. K. Yılmaz; Geraldo; O. Gürbulak; D. Avounou; V. Gheorghe; M. U. Nayir
22/23,Round 6,11/09/22,Kasımpaşa,Galatasaray,2,3,6.64,7.06,4-1-4-1,4-2-3-1,E. Taşkıran; F. Hadergjonaj; D. Graovac; S. Çiftpınar; M. B. Ouanes; M. Tirpan; M. Fall; (c) H. Hajradinović; V. Eysseric; B. Celina; S. Bahoken,(c) F. Muslera; S. Boey; V. Nelsson; E. Bayram; P. v. Aanholt; L. Torreira; S. Oliveira; Y. Akgün; D. Mertens; K. Aktürkoğlu; B. Gomis
22/23,Round 6,11/09/22,Kayserispor,Antalyaspor,1,0,6.9,6.78,4-5-1,4-2-3-1,B. Bayazit; O. Bulut; D. Kolovetsios; A. Kocaman; L. Carole; R. Civelek; M. Cardoso; Campanharo; (c) B. Mensah; M. Thiam; M. Gavranović,R. Boffin; S. Floranus; V. Sarı; F. Kudryashov; G. Vural; Fernando; (c) H. Özmert; A. Ndao; S. Aydoğdu; H. Ghacha; H. Wright
22/23,Round 6,12/09/22,Beşiktaş,Başakşehir,0,1,6.85,6.88,4-3-3,4-3-3,E. Bilgin; V. Rosier; (c) N. Uysal; R. Saiss; A. Masuaku; S. Uçan; B. Vardar; G. Fernandes; J. Muleka; W. Weghorst; G. N'Koudou,V. Babacan; Ö. A. Şahiner; L. Duarte; Y. Ndayishimiye; L. Lima; (c) M. Tekdemir; L. Biglia; B. Özcan; B. Traoré; P. P. Keny; M. Chouiar
22/23,Round 6,12/09/22,Adana DS,Trabzonspor,3,2,6.81,6.56,4-2-3-1,4-2-3-1,E. Özbir; J. Svensson; S. Akaydın; Y. Rakitskyi; K. Rodrigues; B. Ndiaye; (c) B. Stambouli; Y. Sarı; E. Akbaba; H. Onyekuru; Y. Belhanda,(c) U. Çakır; J. Stryger Larsen; M. Bartra; V. Hugo; E. Elmalı; A. Bakasetas; J. Gbamin; M. Trézéguet; U. Bozok; E. Bardhi; M. Gómez
22/23,Round 5,02/09/22,Ümraniyespor,Trabzonspor,0,1,6.88,6.92,3-4-3,4-1-4-1,S. Kırıntılı; Allyson; I. Sackey; (c) T. Glumac; S. Göksu; K. K. Yılmaz; O. Gürbulak; E. Lenjani; O. Ayık; M. U. Nayir; V. Gheorghe,M. T. Tepe; D. Toköz; M. Bartra; S. Denswil; E. Elmalı; J. Gbamin; (c) A. Ömür; A. Bakasetas; E. Bardhi; M. Trézéguet; T. Djaniny
22/23,Round 5,03/09/22,Başakşehir,Alanyaspor,2,0,7.01,6.57,4-3-3,4-2-3-1,V. Babacan; J. Caiçara; L. Duarte; Y. Ndayishimiye; L. Lima; (c) M. Tekdemir; L. Biglia; B. Özcan; S. Gürler; S. Okaka; M. Chouiar,R. Rúnarsson; P. Pereira; F. Bayır; (c) F. Aksoy; J. Balkovec; U. Güneş; L. Fer; Z. Ferhat; E. Bekiroğlu; O. Aydın; W. Eduardo
22/23,Round 5,03/09/22,Sivasspor,Karagümrük,0,0,6.93,6.93,4-1-4-1,4-3-3,A. Ş. Vural; M. Paluli; D. Goutas; A. Appindangoyé; U. Çiftçi; K. Keïta; C. N'Jie; C. Charisis; (c) H. Arslan; M. Gradel; L. James,(c) E. Viviano; S. Dursun; R. Baniya; I. Drešević; C. Erkin; J. Durmaz; M. Ozdoev; O. Shukurov; E. Colley; M. Diagne; F. Borini
22/23,Round 5,03/09/22,Fenerbahçe,Kayserispor,2,0,7.17,6.6,3-5-2,4-3-3,(c) A. Bayındır; Gustavo Henrique; A. Szalai; L. Peres; F. Kadıoğlu; İ. C. Kahveci; Willian Arão; M. Crespo; E. Alioski; João Pedro Galvão; J. King,B. Bayazit; O. Bulut; M. Hosseini; D. Kolovetsios; L. Carole; (c) B. Mensah; Campanharo; R. Civelek; M. Cardoso; M. Gavranović; M. Thiam
22/23,Round 5,03/09/22,Giresunspor,Konyaspor,0,1,6.74,7.08,4-2-3-1,4-2-3-1,(c) O. Piri; H. Bilazer; R. Arias; A. Pérez; A. Uludağ; R. Mejía; M. C. Akpinar; Serginho; D. C. Davas; B. Sainz; R. Bajić,(c) I. Šehić; A. Oğuz; U. Yazğılı; F. Calvo; G. H. Sityá; A. Hadžiahmetović; S. Dikmen; R. Murić; E. Çekiçi; Z. Bytyqi; M. Demir
22/23,Round 5,04/09/22,Hatayspor,Adana DS,1,1,7.05,6.88,4-3-3,4-2-3-1,E. Kardeşler; (c) K. A. Çörekçi; R. B. Yılmaz; S. Falette; S. Adekugbe; M. Boudjemaa; R. Ribeiro; O. Ergün; S. Lobjanidze; A. E. Kaabi; K. Varga,E. Özbir; J. Svensson; S. Akaydın; T. T. Sanuç; K. Rodrigues; B. Ndiaye; (c) B. Stambouli; Y. Sarı; Y. Belhanda; H. Onyekuru; B. Assombalonga
22/23,Round 5,04/09/22,Antalyaspor,Kasımpaşa,0,2,6.77,6.93,4-2-3-1,4-1-4-1,R. Boffin; B. Balcı; (c) V. Sarı; F. Kudryashov; G. Vural; S. Aydoğdu; Fernando; Fredy; L. Adriano; S. Larsson; H. Wright,E. Taşkıran; F. Hadergjonaj; D. Graovac; S. Çiftpınar; M. B. Ouanes; T. Gemicibaşi; M. Fall; (c) H. Hajradinović; V. Eysseric; B. Celina; S. Bahoken
22/23,Round 5,04/09/22,Ankaragücü,Beşiktaş,2,3,6.63,6.71,4-2-3-1,4-2-3-1,B. H. Güngördü; O. Ceylan; A. Çankaya; N. Mujakić; Marlon; Pedrinho; T. Ciğerci; G. Ariyibi; (c) G. Zahid; G. Beridze; F. Macheda,E. Bilgin; V. Rosier; (c) N. Uysal; R. Saiss; A. Masuaku; S. Uçan; G. Fernandes; J. Muleka; D. Alli; G. N'Koudou; W. Weghorst
22/23,Round 5,05/09/22,Galatasaray,Gaziantep,2,1,6.79,6.87,4-2-3-1,4-4-1-1,(c) F. Muslera; S. Boey; V. Nelsson; A. Bardakcı; P. v. Aanholt; L. Torreira; S. Oliveira; Y. Akgün; D. Mertens; K. Aktürkoğlu; B. Gomis,(c) G. Güvenç; S. Kitsiou; E. Ersoy; P. Djilobodji; M. Hanousek; Á. Sagal; M. Jevtović; A. Parmak; M. Eskihellaç; A. Maxim; J. Figueiredo
22/23,Round 4,26/08/22,Gaziantep,Antalyaspor,5,2,6.96,6.64,4-1-4-1,4-2-3-1,(c) G. Güvenç; S. Kitsiou; E. Ersoy; P. Djilobodji; M. Hanousek; M. Jevtović; L. Marković; F. Soyalp; A. Maxim; M. Cihan; J. Figueiredo,R. Boffin; B. Balcı; (c) V. Sarı; F. Kudryashov; G. Vural; Fernando; Fredy; G. Bayrakdar; L. Adriano; S. Larsson; H. Wright
22/23,Round 4,27/08/22,Karagümrük,Ankaragücü,4,1,6.93,6.57,4-1-4-1,4-2-3-1,(c) E. Viviano; S. Dursun; R. Baniya; I. Drešević; C. Erkin; M. Ozdoev; E. Colley; J. Durmaz; O. Shukurov; F. Borini; M. Diagne,B. H. Güngördü; O. Ceylan; S. Osmanoğlu; N. Mujakić; Marlon; Pedrinho; Pêpê; G. Beridze; (c) G. Zahid; Jesé; F. Macheda
22/23,Round 4,27/08/22,Adana DS,Ümraniyespor,1,0,6.91,6.77,4-2-3-1,5-3-2,E. Özbir; J. Svensson; S. Akaydın; T. T. Sanuç; K. Rodrigues; (c) B. Stambouli; B. Ndiaye; D. Babajide; B. Bjarnason; H. Onyekuru; A. Dzyuba,S. Kırıntılı; S. Göksu; Allyson; I. Sackey; (c) T. Glumac; E. Lenjani; A. Mršić; O. Gürbulak; D. Avounou; M. Mimaroğlu; A. Bettaieb
22/23,Round 4,27/08/22,Alanyaspor,İstanbulspor,0,1,6.83,6.78,4-2-3-1,3-4-2-1,R. Rúnarsson; P. Pereira; F. Bayır; J. Balkovec; Y. Özdemir; L. Fer; E. Bekiroğlu; Z. Ferhat; A. Lusamba; W. Eduardo; (c) D. Candeias,D. Jensen; O. Erdoğan; M. Yeşil; T. D. Aksu; O. Berber; M. Kabasakal; M. Sarıkaya; A. Yaşar; J. Topalli; V. Ethemi; (c) İ. Yilmaz
22/23,Round 4,28/08/22,Kasımpaşa,Hatayspor,1,0,6.9,6.81,4-1-4-1,4-3-3,E. Taşkıran; F. Hadergjonaj; D. Graovac; S. Çiftpınar; M. B. Ouanes; T. Gemicibaşi; M. Fall; (c) H. Hajradinović; V. Eysseric; B. Celina; S. Bahoken,E. Kardeşler; (c) K. A. Çörekçi; O. Vranješ; S. Falette; S. Adekugbe; M. Boudjemaa; R. Ribeiro; R. Aabid; S. Bas; A. E. Kaabi; S. Lobjanidze
22/23,Round 4,28/08/22,Kayserispor,Giresunspor,3,0,7.41,6.44,3-1-4-2,4-2-3-1,B. Bayazit; M. Hosseini; D. Kolovetsios; L. Carole; Campanharo; O. Bulut; M. Cardoso; R. Civelek; M. Thiam; C. Mané; (c) İ. Parlak,(c) O. Piri; H. Bilazer; R. Arias; A. Pérez; A. Uludağ; R. Mejía; M. C. Akpinar; Serginho; V. Savićević; B. Sainz; R. Bajić
22/23,Round 4,28/08/22,Trabzonspor,Galatasaray,0,0,6.89,6.98,4-2-3-1,4-2-3-1,M. T. Tepe; J. Stryger Larsen; M. Bartra; (c) V. Hugo; E. Elmalı; M. Siopis; D. Toköz; T. Djaniny; E. Bardhi; M. Trézéguet; A. Cornelius,(c) F. Muslera; S. Boey; V. Nelsson; A. Bardakcı; P. v. Aanholt; L. Torreira; S. Oliveira; Y. Akgün; D. Mertens; K. Aktürkoğlu; H. Seferović
22/23,Round 4,29/08/22,Konyaspor,Fenerbahçe,1,0,6.96,6.48,4-2-3-1,3-5-2,(c) I. Šehić; A. Oğuz; A. Demirbağ; F. Calvo; G. H. Sityá; S. Dikmen; A. Hadžiahmetović; R. Murić; A. Rahmanović; Z. Bytyqi; M. Demir,(c) A. Bayındır; M. Lemos; A. Szalai; L. Peres; F. Kadıoğlu; E. Mor; Willian Arão; M. Zajc; Lincoln; Enner Valencia; D. Rossi
22/23,Round 4,29/08/22,Beşiktaş,Sivasspor,3,1,6.97,6.69,4-2-3-1,4-1-4-1,E. Destanoğlu; V. Rosier; (c) N. Uysal; R. Saiss; A. Masuaku; S. Uçan; G. Fernandes; J. Muleka; D. Alli; G. N'Koudou; W. Weghorst,A. Ş. Vural; E. Yeşilyurt; C. Osmanpaşa; D. Goutas; (c) U. Çiftçi; K. Keïta; M. Yatabaré; C. Charisis; F. Ulvestad; M. Gradel; L. James
22/23,Round 3,19/08/22,Ümraniyespor,Galatasaray,0,1,6.74,7.14,4-1-4-1,4-2-3-1,S. Kırıntılı; S. Göksu; Allyson; (c) T. Glumac; E. Lenjani; O. Gürbulak; O. Ayık; A. Mršić; D. Avounou; Y. D. Valle; A. Bettaieb,(c) F. Muslera; S. Boey; V. Nelsson; A. Bardakcı; P. v. Aanholt; S. Oliveira; L. Torreira; Y. Akgün; E. Akbaba; K. Aktürkoğlu; H. Seferović
22/23,Round 3,20/08/22,Giresunspor,Kasımpaşa,1,0,6.94,6.87,4-2-3-1,4-1-4-1,(c) O. Piri; H. Bilazer; R. Arias; A. Pérez; A. Uludağ; H. Traoré; R. Mejía; Serginho; V. Savićević; B. Sainz; R. Bajić,E. Taşkıran; F. Hadergjonaj; D. Graovac; S. Çiftpınar; R. Petretta; T. Gemicibaşi; M. Fall; (c) H. Hajradinović; V. Eysseric; A. Engin; S. Bahoken
22/23,Round 3,20/08/22,Hatayspor,Gaziantep,1,2,6.75,6.71,4-3-3,4-1-4-1,E. Kardeşler; (c) K. A. Çörekçi; O. Vranješ; S. Falette; S. Adekugbe; M. Çağıran; R. Ribeiro; R. Aabid; S. Lobjanidze; A. E. Kaabi; D. Saint-Louis,(c) G. Güvenç; S. Kitsiou; E. Ersoy; P. Djilobodji; M. Hanousek; M. Jevtović; L. Marković; F. Soyalp; A. Maxim; M. Eskihellaç; J. Figueiredo
22/23,Round 3,20/08/22,Antalyaspor,Trabzonspor,5,2,7.06,6.53,4-2-3-1,4-1-4-1,R. Boffin; B. Balcı; (c) V. Sarı; F. Kudryashov; G. Vural; Fernando; Fredy; A. Ndao; L. Adriano; S. Larsson; H. Wright,(c) U. Çakır; J. Stryger Larsen; S. Denswil; V. Hugo; E. Elmalı; D. Haspolat; T. Djaniny; D. Toköz; A. Bakasetas; M. Trézéguet; A. Cornelius
22/23,Round 3,21/08/22,Başakşehir,Kayserispor,2,0,6.99,6.76,4-1-4-1,4-1-4-1,M. Şengezer; (c) J. Caiçara; Y. Ndayishimiye; A. Touba; L. Lima; L. Biglia; D. Türüç; D. Aleksić; B. Özcan; N. Chadli; P. Szysz,B. Bayazit; O. Bulut; M. Hosseini; (c) D. Kolovetsios; L. Carole; A. Karimi; E. Başsan; M. Cardoso; A. Bertolacci; M. Thiam; M. Pektemek
22/23,Round 3,21/08/22,Beşiktaş,Karagümrük,4,1,7.1,6.51,4-1-4-1,4-2-3-1,E. Destanoğlu; V. Rosier; (c) N. Uysal; R. Saiss; A. Masuaku; B. Vardar; J. Muleka; S. Uçan; G. Fernandes; G. N'Koudou; W. Weghorst,(c) E. Viviano; D. Biraschi; B. Bekaroğlu; I. Drešević; C. Erkin; O. Shukurov; M. Ozdoev; A. Musa; M. Mercan; F. Borini; M. Diagne
22/23,Round 3,22/08/22,İstanbulspor,Konyaspor,0,4,6.58,7.09,3-4-2-1,4-1-3-2,D. Jensen; O. Erdoğan; M. Yeşil; T. D. Aksu; O. Berber; M. Sarıkaya; M. Kabasakal; A. Yaşar; J. Topalli; V. Ethemi; (c) İ. Yilmaz,(c) I. Šehić; A. Oğuz; A. Demirbağ; F. Calvo; G. H. Sityá; A. Hadžiahmetović; R. Murić; E. Çekiçi; Z. Bytyqi; M. Demir; D. Pavičić
22/23,Round 3,22/08/22,Sivasspor,Alanyaspor,1,1,6.79,6.8,4-3-3,4-2-3-1,A. Ş. Vural; M. Paluli; A. Appindangoyé; C. Osmanpaşa; U. Çiftçi; (c) H. Arslan; K. Keïta; C. Charisis; C. N'Jie; M. Yatabaré; M. Gradel,R. Rúnarsson; P. Pereira; F. Aksoy; F. Bayır; J. Balkovec; L. Fer; E. Bekiroğlu; (c) D. Candeias; A. Lusamba; Z. Ferhat; W. Eduardo
